{
    "id": 1,
    "name": "管理者",
    "login_id": "admin",
    "department": "サンプルdepartment",
    "password": "サンプルpassword",
    "salt": "サンプルsalt",
    "sort_no": 1,
    "two_factor_auth_key": "サンプルtwo_factor_auth_key",
    "two_factor_auth_enabled": false,
    "create_date": "2024-01-01T00:00:00+09:00",
    "update_date": "2024-01-01T00:00:00+09:00",
    "login_date": null,
    "work": {
        "id": 1,
        "name": "サンプルWork"
    },
    "authority": {
        "id": 1,
        "name": "サンプルAuthority"
    },
    "member": {
        "id": 1,
        "name": "サンプルMember"
    }
}